{
  "schema_version": 1,
  "task_id": "example",
  "target_id": "example-snapshot",
  "status": "complete",
  "kind": "review",
  "summary": "Illustrative passing review; not evidence for this repository.",
  "verdict": "pass",
  "violations": [],
  "bugs": [],
  "suggestions": [
    "Optional: explain the source mismatch error."
  ],
  "checked_scope": [
    "Example fixture only"
  ],
  "evidence": [
    "Example-only assertion demonstrating contract shape."
  ],
  "unresolved": []
}
